<?xml version="1.0" encoding="UTF-8"?>
<!ELEMENT pr (metadata, team, abstract, deliverables) >

<!ELEMENT metadata (keyName, title, subtitle?, beginDate, endDate, supervisor) >
<!ELEMENT keyName (#PCDATA) >
<!ELEMENT title (#PCDATA) >
<!ELEMENT beginDate (#PCDATA) >
<!ELEMENT endDate (#PCDATA) >
<!ELEMENT subtitle (#PCDATA) >
<!ELEMENT supervisor (name, url) >
<!ELEMENT name (#PCDATA) >

<!ELEMENT team (tElement|(tElement, tElement)|(tElement, tElement, tElement)) >
<!ELEMENT tElement (name, email, url) >
<!ATTLIST tElement
    id ID #REQUIRED>
<!ELEMENT email (#PCDATA) >
    
<!ELEMENT abstract (paragraph)+ >
<!ELEMENT paragraph (#PCDATA|italic|bold|underline|url)* >
<!ELEMENT italic (#PCDATA|bold|underline|url)* >
<!ELEMENT bold (#PCDATA|italic|underline|url)* >
<!ELEMENT underline (#PCDATA|italic|bold|url)* >
<!ELEMENT url (#PCDATA|italic|bold|underline)* >
<!ATTLIST url
    type (internal|external) "external">

<!ELEMENT deliverables (link)+ >
<!ELEMENT link (name,url) >